<?xml version="1.0" encoding="UTF-8"?>
<!--

    Elastic Grid
    Copyright (C) 2008-2009 Elastic Grid, LLC.
    
    This program is free software: you can redistribute it and/or modify
    it under the terms of the GNU Affero General Public License as
    published by the Free Software Foundation, either version 3 of the
    License, or (at your option) any later version.
    
    This program is distributed in the hope that it will be useful,
    but WITHOUT ANY WARRANTY; without even the implied warranty of
    MERCHANTABILITY or FITNESS FOR A PARTICULAR PURPOSE.  See the
    GNU Affero General Public License for more details.
    
    You should have received a copy of the GNU Affero General Public License
    along with this program.  If not, see <http://www.gnu.org/licenses/>.

-->

<binding name="ElasticGridREST"
         xmlns:xsi="http://www.w3.org/2001/XMLSchema-instance"
         xsi:noNamespaceSchemaLocation="binding.xsd">

    <namespace prefix="eg"  uri="urn:elastic-grid:eg" default="elements"/>
    <namespace prefix="ec2" uri="urn:elastic-grid:ec2" default="none"/>
    <namespace prefix="lan" uri="urn:elastic-grid:lan" default="none"/>

    <format type="java.net.InetAddress"
            serializer="com.elasticgrid.model.internal.jibx.Conversion.serializeInetAddress"
            deserializer="com.elasticgrid.model.internal.jibx.Conversion.deserializeInetAddress"/>

    <format type="com.elasticgrid.model.NodeProfile"
            serializer="com.elasticgrid.model.internal.jibx.Conversion.serializeNodeProfile"
            deserializer="com.elasticgrid.model.internal.jibx.Conversion.deserializeNodeProfile"/>

    <mapping name="clusters" class="com.elasticgrid.model.internal.Clusters">
        <collection field="clusters"/>
    </mapping>
    <mapping name="applications" class="com.elasticgrid.model.internal.Applications">
        <collection field="applications"/>
    </mapping>

    <mapping class="com.elasticgrid.model.internal.AbstractCluster" abstract="true">
        <value name="name" field="name" style="attribute"/>
        <!--<value name="href" field="name" style="attribute"/>-->
        <collection field="applications"/>
    </mapping>
    <mapping name="cluster" ns="urn:elastic-grid:ec2"
             class="com.elasticgrid.model.ec2.impl.EC2ClusterImpl" extends="com.elasticgrid.model.internal.AbstractCluster">
        <structure map-as="com.elasticgrid.model.internal.AbstractCluster"/>
        <collection get-method="getNodes" set-method="setNodes"
                    item-type="com.elasticgrid.model.ec2.impl.EC2NodeImpl"
                    factory="com.elasticgrid.model.internal.AbstractCluster.setOfNodes"/>
    </mapping>
    <mapping name="cluster" ns="urn:elastic-grid:lan"
             class="com.elasticgrid.model.lan.impl.LANClusterImpl" extends="com.elasticgrid.model.internal.AbstractCluster">
        <structure map-as="com.elasticgrid.model.internal.AbstractCluster"/>
        <collection get-method="getNodes" set-method="setNodes"
                    item-type="com.elasticgrid.model.lan.impl.LANNodeImpl"
                    factory="com.elasticgrid.model.internal.AbstractCluster.setOfNodes"/>
    </mapping>

    <mapping name="cluster-provisioning" class="com.elasticgrid.model.ClusterProvisioning">
        <value name="name" field="clusterName" style="attribute"/>
        <value name="monitors" field="numberOfMonitors"/>
        <value name="agents" field="numberOfAgents"/>
    </mapping>

    <mapping class="com.elasticgrid.model.internal.AbstractNode" abstract="true">
        <value name="profile" field="profile" style="attribute"/>
        <value field="address" style="text"/>
    </mapping>
    <mapping name="node" ns="urn:elastic-grid:ec2"
             class="com.elasticgrid.model.ec2.impl.EC2NodeImpl" extends="com.elasticgrid.model.internal.AbstractNode">
        <structure map-as="com.elasticgrid.model.internal.AbstractNode"/>
        <value name="id" field="instanceID" style="attribute"/>
    </mapping>
    <mapping name="node" ns="urn:elastic-grid:lan"
             class="com.elasticgrid.model.lan.impl.LANNodeImpl" extends="com.elasticgrid.model.internal.AbstractNode">
        <value name="id" field="instanceID" style="attribute"/>
        <structure map-as="com.elasticgrid.model.internal.AbstractNode"/>
    </mapping>

    <mapping name="application" class="com.elasticgrid.model.internal.ApplicationImpl">
        <value name="name" field="name" style="attribute"/>
        <collection field="services" item-type="com.elasticgrid.model.internal.ServiceImpl"/>
    </mapping>

    <mapping name="service" class="com.elasticgrid.model.internal.ServiceImpl">
        <value name="name" field="name" style="attribute"/>
    </mapping>

</binding>
