<?xml version="1.0" encoding="UTF-8"?>
<!--

    Elastic Grid
    Copyright (C) 2008-2010 Elastic Grid, LLC.

    This program is free software: you can redistribute it and/or modify
    it under the terms of the GNU Affero General Public License as
    published by the Free Software Foundation, either version 3 of the
    License, or (at your option) any later version.

    This program is distributed in the hope that it will be useful,
    but WITHOUT ANY WARRANTY; without even the implied warranty of
    MERCHANTABILITY or FITNESS FOR A PARTICULAR PURPOSE.  See the
    GNU Affero General Public License for more details.

    You should have received a copy of the GNU Affero General Public License
    along with this program.  If not, see <http://www.gnu.org/licenses/>.

-->
<binding name="ElasticGrid"
         xmlns:xsi="http://www.w3.org/2001/XMLSchema-instance"
         xsi:noNamespaceSchemaLocation="binding.xsd">

    <namespace uri="http://aws.amazon.com/s3" prefix="s3"/>

    <format type="java.net.InetAddress"
            serializer="com.elasticgrid.model.internal.jibx.Conversion.serializeInetAddress"
            deserializer="com.elasticgrid.model.internal.jibx.Conversion.deserializeInetAddress"/>

    <mapping name="local-repository" class="com.elasticgrid.model.internal.LocalStore"
             extends="com.elasticgrid.model.internal.AbstractStore">
        <structure map-as="com.elasticgrid.model.internal.AbstractStore"/>
    </mapping>
    <mapping name="remote-repository" class="com.elasticgrid.model.internal.RemoteStore"
             extends="com.elasticgrid.model.internal.AbstractStore">
        <value name="s3:bucket" constant="1234"/>
        <structure map-as="com.elasticgrid.model.internal.AbstractStore"/>
    </mapping>

    <mapping class="com.elasticgrid.model.internal.AbstractStore" abstract="true">
        <collection name="clusters" field="clusters" item-type="java.lang.String" usage="optional"
                    factory="com.elasticgrid.model.internal.AbstractStore.setOfClusters">
            <structure name="cluster">
                <value name="name" style="attribute"/>
            </structure>
        </collection>
        <collection name="applications" field="applications" item-type="java.lang.String" usage="optional"
                    factory="com.elasticgrid.model.internal.AbstractStore.setOfApplications">
            <structure name="application">
                <value name="name" style="attribute"/>
            </structure>
        </collection>
    </mapping>

    <mapping class="com.elasticgrid.model.internal.AbstractCluster" abstract="true">
        <value name="name" field="name" style="attribute"/>
        <collection name="applications" field="applications"
                    item-type="com.elasticgrid.model.internal.ApplicationImpl"
                    factory="com.elasticgrid.model.internal.Factories.listOfApplications"/>
    </mapping>
    <mapping name="cluster" class="com.elasticgrid.model.ec2.impl.EC2ClusterImpl" extends="com.elasticgrid.model.internal.AbstractCluster">
        <namespace prefix="ec2" uri="http://aws.amazon.com/ec2" default="elements"/>
        <structure map-as="com.elasticgrid.model.internal.AbstractCluster"/>
        <collection name="nodes" get-method="getNodes" set-method="setNodes"
                    item-type="com.elasticgrid.model.ec2.impl.EC2NodeImpl"
                    factory="com.elasticgrid.model.internal.AbstractCluster.setOfNodes"/>
    </mapping>

    <mapping class="com.elasticgrid.model.internal.AbstractNode" abstract="true">
        <value name="address" field="address"/>
    </mapping>
    <mapping name="node" class="com.elasticgrid.model.ec2.impl.EC2NodeImpl" extends="com.elasticgrid.model.internal.AbstractNode">
        <namespace prefix="ec2" uri="http://aws.amazon.com/ec2" default="elements"/>
        <structure map-as="com.elasticgrid.model.internal.AbstractNode"/>
        <value name="instanceID" field="instanceID"/>
    </mapping>

    <mapping name="application" class="com.elasticgrid.model.internal.ApplicationImpl">
        <value name="name" field="name" style="attribute"/>
    </mapping>

</binding>
